id;brand;legal;eik;eik_url;founded;city;capital;capital_text;owner;group;is_group_head;parent_brand_id;hide_from_list;source_usa;source_ca;source_kr;source_jp;source_eu;web;phone;phone_2;email;social_facebook;social_instagram;social_viber;social_youtube;social_tiktok;social_linkedin;social_mobile_bg;social_cars_bg;verified;is_new;blurb;last_checked;verification_notes
north-auto;North Auto;НОРТ АУТО БЪЛГАРИЯ ЕООД;202092526;https://papagal.bg/eik/202092526/2d83;2012-05-31;София;10225;10 225,00 €;ЦВЕТОМИР ПЛАМЕНОВ МИТЕВ (100%, и управител);North Auto;yes;;;yes;yes;;;;https://north-auto.com/;359 888 751 247;;sales@north-auto.com;https://www.facebook.com/northautobg/;;https://invite.viber.com/?g2=AQAlqX4R8PG97FMc1ivQP9n3pnG0TGb9xLU1K%2Fun5T44116SHXj35LXzUaXWdPAF&lang=en;;;;;;;;Първоначално регистрирана като 'РАЙТ КОЛ' до преименуването през август 2023 г. Най-вероятно операторът на north-auto.com. Самият сайт декларира свързани марки: American Dreamcars, Fast Lane America, Urban Motors.;2026-05-24;Registry confirmed via agent-browser 2026-05-24. Legal/founded/city confirmed. Capital converted from 20 000 лв. to 10 225 €. Owner filled: ЦВЕТОМИР ПЛАМЕНОВ МИТЕВ (100%, и управител).
american-dreamcars;American Dreamcars;(търговско име — North Auto group);;;;София;;;;North Auto;;north-auto;;yes;yes;;;;https://americandreamcars.bg/;;;;https://www.facebook.com/americadreamcars/;;;;;;;;;;Декларирана от North Auto като свързана марка. Няма самостоятелно юридическо лице в Търговския регистър.;2026-05-24;"Sub-brand of north-auto; no own registry entry. Site americandreamcars.bg unreachable (ECONNREFUSED) 2026-05-24."
fast-lane-america;Fast Lane America;(търговско име — North Auto group);;;;София;;;;North Auto;;north-auto;;yes;yes;;;;https://fastlaneamerica.com/;;;;;;;;;;https://fastlaneamerica.mobile.bg/;;;;Слоган: 'Здрави коли на дилърски цени от Америка'. Декларирана от North Auto като свързана марка.;2026-05-24;"Sub-brand of north-auto; no own registry entry. Site fastlaneamerica.com has TLS cert error 2026-05-24; mobile.bg listing active."
urban-motors;Urban Motors;(търговско име — North Auto group);;;;София;;;;North Auto;;north-auto;;yes;yes;;;;;359 883 391 112;;;https://www.facebook.com/urban.motorsbg/;https://www.instagram.com/urban.motors/;;;;;;;;;Декларирана от North Auto като свързана марка. Да не се бърка с 'Urban Motors Denver' в САЩ или 'Urban Motors Collection' в Ню Джърси.;2026-05-24;"Sub-brand of north-auto; no own registry entry. Site urbanmotors.bg unreachable (ECONNREFUSED) 2026-05-24."
wincars-main;WINCARS;ВИНКАРС ЕООД;207634475;https://papagal.bg/eik/207634475/afe7;2023-12-14;София;2;2,00 €;Иван Иванович Ганчев (100%, и управител);WINCARS;yes;;;yes;yes;yes;;;https://wincars.bg/;359 889 333 631;;wincarsbulgaria@gmail.com;https://www.facebook.com/wincars.bg;https://www.instagram.com/wincars.bg;https://invite.viber.com/?g2=AQAp47Wvj2a9xlEchEkAajcjIsGzqaZQhMzR94s0dFs4o8UItSznkKGwjm3MZY%2BR&fbclid=IwY2xjawSAPx5leHRuA2FlbQIxMABicmlkETBLY1NtN1JGWG5Cc3ZHZDhHc3J0YwZhcHBfaWQQMjIyMDM5MTc4ODIwMDg5MgABHqdKApl-FedNKjP2RvyQ4e5cL0Mx6Fm_MnbYtCib32aG6snzopO0vScDkg9U_aem_l_YKoyxpq8766QvIt8q4sg&lang=en;https://www.youtube.com/@WINCARS.BULGARIA;https://www.tiktok.com/@wincars.bg;;https://m.mobile.bg/dealers/wincars-central;https://www.cars.bg/company/wincarsplovdiv;;;Сграда Margel, София, Околовръстен път 155, ет. 2. Пет свързани фирми ВИНКАРС/УИНКАРС — нетипично сложна структура за тази индустрия. 5 отделни Mobile.bg витрини за различни локации.;2026-05-24;Registry confirmed via agent-browser 2026-05-24. Founded/city confirmed. Capital converted from 5 лв. to 2 €. Owner filled: Иван Иванович Ганчев (100%, и управител). Site OK: phone/email/socials confirmed. Telegram bot also found (not stored).
wincars-plus;WINCARS+;УИНКАРС ПЛЮС ЕООД;207634518;https://papagal.bg/eik/207634518/9fb8;2023-12-14;София;2;2,00 €;ИВАН ИВАНОВИЧ ГАНЧЕВ (100%, и управител);WINCARS;;wincars-main;yes;yes;yes;;;;;;;;;;;;;;;;;;Свързано лице, регистрирано същия ден като ВИНКАРС ЕООД. Споделя сайта на главната фирма.;2026-05-24;"Registry confirmed via agent-browser 2026-05-24. Founded/city confirmed. Capital converted from 5 лв. to 2 €. Owner filled: ИВАН ИВАНОВИЧ ГАНЧЕВ (100%, и управител). No own site; shares wincars.bg. Existing values retained."
vincars-companion;WINCARS Co.;ВИНКАРС КОМПАНИ ЕООД;208059064;https://papagal.bg/eik/208059064/2cb0;2024-11-13;София;2;2,00 €;ИВАН ИВАНОВИЧ ГАНЧЕВ (100%, и управител);WINCARS;;wincars-main;yes;yes;yes;;;;;;;;;;;;;;;;;;Втора вълна на регистрации в групата WINCARS.;2026-05-24;Registry confirmed via agent-browser 2026-05-24. Founded/city confirmed. Capital converted from 5 лв. to 2 €. Owner filled: ИВАН ИВАНОВИЧ ГАНЧЕВ (100%, и управител). No own site. Existing values retained.
wincars-plus-companion;WINCARS+ Co.;УИНКАРС ПЛЮС КОМПАНИ ЕООД;208059159;https://papagal.bg/eik/208059159/9689;2024-11-13;София;2;2,00 €;ИВАН ИВАНОВИЧ ГАНЧЕВ (100%, и управител);WINCARS;;wincars-main;yes;yes;yes;;;;;;;;;;;;;;;;;;Свързано лице, регистрирано същия ден като ВИНКАРС КОМПАНИ ЕООД.;2026-05-24;Registry confirmed via agent-browser 2026-05-24. Founded/city confirmed. Capital converted from 5 лв. to 2 €. Owner filled: ИВАН ИВАНОВИЧ ГАНЧЕВ (100%, и управител). No own site. Existing values retained.
win-cars;WIN CARS;УИН КАРС ЕООД;207285529;https://papagal.bg/eik/207285529/dee3;2023-03-01;София;5;5,00 €;ИВАН ИВАНОВИЧ ГАНЧЕВ (100%, и управител);WINCARS;;wincars-main;yes;yes;yes;;;;;;;;;;;;;;;;;;Възможно е да е първоначалната / 'стара' фирма на групата WINCARS.;2026-05-24;Registry confirmed via agent-browser 2026-05-24. Founded filled: 2023-03-01. City confirmed. Capital converted from 10 лв. to 5 €. Owner filled: ИВАН ИВАНОВИЧ ГАНЧЕВ (100%, и управител). No own site. Existing values retained.
mak-auto;MAK AUTO;(юридическото лице не е идентифицирано еднозначно);;;;София;;;;MAK GROUP;;;;yes;yes;;;;https://makauto.eu/;359 877 400 520;;sales@makauto.eu;https://www.facebook.com/profile.php?id=100088853903957;https://www.instagram.com/makauto.eu/;https://invite.viber.com/?g2=AQAKMqhHlO837VKBMYSm5Q2dvyUyTArlamXok4KLF%2FQHSgT42EhLyxbjExhriKhI;https://www.youtube.com/@Makautoeu;;;;;;;На сайта се представя като 'MAK GROUP'. Оперира свързана аукционна платформа MAKBID.EU. Финансов партньор: TBI Bank. Внимание: МАК АУТО РЕНТ ЕООД (ЕИК 201462816) е различен бизнес (отдаване под наем).;2026-05-24;"No EIK in CSV. Site OK: phone/email confirmed; added Facebook and YouTube found on site."
koliotamerika;Коли от Америка;(БГ фирма не е намерена) + Hwy 17 Auto Sales (САЩ дилър);;;;София;;;;Коли от Америка;;;;yes;yes;;;;https://koliotamerika.bg/;359 888 292 280;;office@koliotamerika.bg;https://www.facebook.com/koliotamerika;https://www.instagram.com/koliotamerika.bg/;https://invite.viber.com/?g2=AQBf2nuz85eJe1JY6ulMhdFRCDVjUHmNSdbAEnHgqAjWvqKA3%2FiJ%2FJ6vadMAgs1C;;;;;;;;Оперира собствен дилърски център в САЩ: Hwy 17 Auto Sales, 5116 Ogeechee Rd Lot 7, Savannah, GA. Седалище: ул. Стар Лозенски път, София. Вертикална интеграция — пряк достъп до търговете под собствен дилърски лиценз в САЩ.;2026-05-24;No EIK in CSV. Site OK: added phone, email, and Facebook found on site.
bidmotors;BidMotors;БИДМОТОРС ООД;207639650;https://papagal.bg/eik/207639650/399d;2023-12-19;Пловдив;52;52,00 €;Антон Илич Генов (50%) · Елена Семеновна Велчева (50%);;;;;yes;yes;yes;;yes;https://bidmotors.bg/;359 888 285 928;;info@bidmotors.bg;https://www.facebook.com/bidmotors.bg/;;https://invite.viber.com/?g2=AQBdBz1%2FCiibikz4AEaVnLXVCMFdxWopHgvl9ggwM%2BY1igDxPZAD0uLL7XfzMh7S&lang=en;;;;https://bidmotors.mobile.bg/;https://www.cars.bg/company/bidmotors;;;Първоначално регистрирана като 'ЮСА КАРС', преименувана на БИДМОТОРС на 14 февруари 2024 г. Адрес: Пещерско шосе 198, Пловдив. Собствениците носят бащини имена, типични за руски/постсъветски граждани (Илич, Семеновна). EU-огледало на сайта: bidmotors.eu.;2026-05-24;"Registry confirmed via agent-browser 2026-05-24. Founded/city confirmed. Capital converted from 100 лв. to 52 €. Ownership confirmed: Антон Илич Генов (50%) · Елена Семеновна Велчева (50%); manager is ВЛАДИМИР ПЕТРОВИЧ ВЕЛЧЕВ. Address updated: Пещерско шосе 217. Site bidmotors.bg returned 403. Existing values retained."
triumphcars-bg;TriumphCars;ТРИУМФ КАРС БГ ООД;208343070;https://papagal.bg/eik/208343070/13e4;2025-06-05;София;1;1,00 €;СТЕФАН РОСЕНОВ АНГЕЛОВ (50%, управител) · ДЕНИСЛАВ ПЕТКОВ ПЕТКОВ (50%, управител);TriumphCars;yes;;;yes;yes;;;;https://www.triumphcars.bg/;;;;https://www.facebook.com/TRIUMPHCARSBG/;;https://invite.viber.com/?g2=AQAWng4d2ZQr5VQZRkDSUypPFQFgtYBLFr4JOqKcV9xWIDdlEvSlB6M5kovTRyyY&lang=en;https://www.youtube.com/@TRIUMPHCARS;;;;https://www.cars.bg/company/triumphcarssofia;;;"Фирмата е едва шестмесечна към момента на проверката — твърдението '№1 дилър' е преувеличено. В CARS.BG като дилър е изписан Светослав Ананиев; управителят по регистър е Стефан Росенов Ангелов. Седалище: Манастирски ливади, София.";2026-05-24;Registry confirmed via agent-browser 2026-05-24. Founded/city confirmed. Capital 1 €. Owner updated: 2 co-managers/owners — СТЕФАН РОСЕНОВ АНГЕЛОВ (50%) · ДЕНИСЛАВ ПЕТКОВ ПЕТКОВ (50%). Site fetch failed (403).
triumphcars-old;ТРИУМФ КАРС;ТРИУМФ КАРС ООД;208130243;https://papagal.bg/eik/208130243/86a8;2025-01-16;София;51;51,00 €;ДЕНИСЛАВ ПЕТКОВ ПЕТКОВ (50%, управител) · СТЕФАН РОСЕНОВ АНГЕЛОВ (50%, управител);TriumphCars;;triumphcars-bg;yes;yes;yes;;;;;;;;;;;;;;;;;;Предхождащо / свързано лице на ТРИУМФ КАРС БГ ООД.;2026-05-24;"Registry confirmed via agent-browser 2026-05-24. Founded filled: 2025-01-16. City confirmed. Capital 51 €. Owner filled: ДЕНИСЛАВ ПЕТКОВ ПЕТКОВ (50%) · СТЕФАН РОСЕНОВ АНГЕЛОВ (50%). Status: Активен (not deregistered). Sub-brand of triumphcars-bg; no own web."
mostauto-import;MostAuto;МОСТ АУТО ИМПОРТ ООД;206578080;https://papagal.bg/eik/206578080/3785;2021-07-08;Сливен;511;511,00 €;СТОЯН КЪНЕВ СТЕФАНОВ (50%, управител) · МОМЧИЛ НИКОЛАЕВ ХРИСТОВ (50%, управител);MostAuto;yes;;;yes;yes;;;;https://mostauto.bg/;359 886 802 250;359 878 495 595;mostauto.bg@gmail.com;https://www.facebook.com/mostautobg/;https://www.instagram.com/mostauto.bg/;;;;;;;;;Активното юридическо лице. Партньори, посочени на сайта: Car-sales.bg, Max service.;2026-05-24;Registry confirmed via agent-browser 2026-05-24. Founded/city confirmed. Capital converted from 1 000 лв. to 511 €. Owner filled: СТОЯН КЪНЕВ СТЕФАНОВ (50%) · МОМЧИЛ НИКОЛАЕВ ХРИСТОВ (50%). Site OK. Phone/email confirmed.
mostauto-legacy;MostAuto (стара);МОСТ АУТО ООД;205387268;https://papagal.bg/eik/205387268/1a90;2018-11-10;Сливен;255;255,00 €;СТОЯН КЪНЕВ СТЕФАНОВ (50%, управител) · МОМЧИЛ НИКОЛАЕВ ХРИСТОВ (50%, управител);MostAuto;;mostauto-import;yes;yes;yes;;;;;;;;;;;;;;;;;;Дерегистрирана по ЗДДС на 12.04.2023 г. На практика бездейства. Винаги проверявайте с кое юридическо лице сключвате договор.;2026-05-24;Registry confirmed via agent-browser 2026-05-24. Founded/city confirmed. Capital converted from 500 лв. to 255 €. Owner filled: СТОЯН КЪНЕВ СТЕФАНОВ (50%) · МОМЧИЛ НИКОЛАЕВ ХРИСТОВ (50%). Status: Активен (ЗДДС дерегистрирана 12.04.2023 but legal entity still active). Same owners as mostauto-import.
freeline;Freeline;ФРИЛАЙН ООД;131233772;https://papagal.bg/eik/131233772/adce;2008-07-30;София;2556;2 556,00 €;ВЕЛИН ГЕОРГИЕВ МАРИНКОВ (80%, управител) · ИЗАБЕЛА ДИНЧЕВА ДИМИТРОВА (20%);Freeline;yes;;;yes;yes;;;yes;https://freeline.bg/;359 2 915 1140;;headoffice@freeline.bg;;;;;;https://bg.linkedin.com/company/freeline;;;;;"Най-голямата в каталога по обороти: 18,5 млн. лв. за 2021 г. (+37% годишно). Преди всичко логистична компания; колите са една от много карго услуги. Декларира над 4000 превозени автомобила.";2026-05-24;"Registry confirmed via agent-browser 2026-05-24. City confirmed. Note: registry date shows ""2004 година"" (EIK 131233772 registered 2004); CSV founded 2008-07-30 refers to a structural change date in registry history. Capital converted from 5 000 лв. to 2 556 €. Owner filled: ВЕЛИН ГЕОРГИЕВ МАРИНКОВ (80%) · ИЗАБЕЛА ДИНЧЕВА ДИМИТРОВА (20%). Site OK. Phone/email confirmed."
freeline-bg;Freeline BG;ФРИЛАЙН БГ ООД;203321113;https://papagal.bg/eik/203321113/ea8e;2014-12-05;София;25;25,00 €;Велин Георгиев Маринков (80%, управител) · Изабела Динчева Димитрова (20%);Freeline;;freeline;yes;yes;yes;;;;;;;;;;;;;;;;;;Свързано лице на основната ФРИЛАЙН ООД.;2026-05-24;"Registry confirmed via agent-browser 2026-05-24. Founded/city confirmed. Capital converted from 50 лв. to 25 €. Owner filled: Велин Георгиев Маринков (80%) · Изабела Динчева Димитрова (20%). Sub-brand of freeline; no own web."
xclusivecars;Xclusivecars;ЕКСКЛУЗИВЕ КАРС ЕООД;207194200;https://papagal.bg/eik/207194200/98dc;2022-12-14;с. Писарево;511;511,00 €;САШО АСЕНОВ ДЖАМБАЗОВ (100%, и управител);;;;;yes;yes;;;;https://xclusivecars.bg/;359 888 885 962;359 876 888 994;office@xclusivecars.bg;https://www.facebook.com/xclusivecars.bg/;https://www.instagram.com/xclusivecars.bg/;https://invite.viber.com/?g2=AQBxFIC8IoVOjFKfHv2pl4LY0sxwE%2FcYEoOzcP8glhC18rZvDsjDM9H9ZxwiEGI6;;;;https://xclusivecars.mobile.bg/;https://www.cars.bg/company/xclusivecars;;;Първоначално регистрирана като 'ЕМ - СА КАРГО', преименувана на ЕКСКЛУЗИВЕ КАРС на 10.04.2024 г. Самоопределя се като 'лицензиран дилър'. Аукционни партньори: IAAI, Copart, OpenLane EU.;2026-05-24;"Registry confirmed via agent-browser 2026-05-24. Founded/city confirmed (с. Писарево). Capital converted from 1 000 лв. to 511 €. Owner filled: САШО АСЕНОВ ДЖАМБАЗОВ (100%, и управител). Note: site listed owner as ""Павел Колев"" — registry shows САШО АСЕНОВ ДЖАМБАЗОВ. Site OK. Added social_instagram. Phone/email/Viber confirmed."
playcars;PLAYCARS;ПЛЕЙ КАРС ЕООД;207637959;https://papagal.bg/eik/207637959/6f73;2023-12-18;София;511;511,00 €;Велко Валериев Ангелов (100%);;;;;yes;yes;;;;https://playcars.bg/;359 877 705 770;359 886 709 271;playcarsbulgaria@gmail.com;https://www.facebook.com/PlayCarsBulgaria/;https://www.instagram.com/playcars.bg/;;;;;https://playcars.mobile.bg/;https://www.cars.bg/company/playcars;;;Един собственик. Активен профил в Mobile.bg и Cars.bg.;2026-05-24;Registry confirmed via agent-browser 2026-05-24. Founded/city confirmed. Capital converted from 1 000 лв. to 511 €. Owner Велко Валериев Ангелов (100%, и управител) confirmed. Site OK. Added phone, phone_2, email, social_facebook from site.
key4u;Key4U;КИЙ ФОР Ю ЕООД;207170612;https://papagal.bg/eik/207170612/70d0;2022-11-24;София;100;51,00 €;АНГЕЛ ДИМИТРОВ ПЕЙЧИНОВ (100%, и управител);;;;;yes;yes;;;;https://key4u.bg/;359 898 252 434;;key4u.import@gmail.com;;;;;;;https://key4u.mobile.bg/;;;;Първоначално регистрирана като 'АРЧИЛЕМО', преименувана на КИЙ ФОР Ю едва на 19.06.2025 г. — много скоро преориентиран бизнес от несвързана дейност. Фокус: BMW, Mercedes, Audi, Tesla.;2026-05-24;"Registry confirmed via agent-browser 2026-05-24. Founded/city confirmed. Capital 51 € confirmed. Owner filled: АНГЕЛ ДИМИТРОВ ПЕЙЧИНОВ (100%, и управител); previous owner ФИЛИПА ДИМИТРОВА ГАНОВА replaced on 19.06.2025 when company renamed from АРЧИЛЕМО to КИЙ ФОР Ю. Site OK. Phone/email/Viber confirmed."
bohem-cars;Bohem Cars;Бохемкарс ООД;207580821;https://papagal.bg/eik/207580821/6ed0;2023-10-31;Перник;100;51,00 €;ГЕОРГИ ПЛАМЕНОВ МОМЪКОВ (50%, управител) · ЦВЕТАН ДИМИТРОВ ГУГЛЕВ (50%);;;;;;yes;;;;https://bohemcars.net/;359 893 588 680;;bohemcars@gmail.com;https://www.facebook.com/p/BohemCars-100090502502398/;;https://invite.viber.com/?g2=AQAMxyLjvWlk%2FlHGq8xd7qpMRMyZvgIA20ahTwc2xZeW1nMGmSkYemUD9cv1trGj;;;;https://bohemcars.mobile.bg/;;;;Специализация Канада (с Carfax/AutoCheck). Оперира от София и Пловдив. НЕ е същото като Ауто Бохеми ЕООД (ЕИК 206420162) — различна фирма.;2026-05-24;Registry confirmed via agent-browser 2026-05-24. Founded/city confirmed. Capital 51 € confirmed. Owner spelling corrected: МОМЪКОВ (registry) vs МОМКОВ (prior CSV). Site OK. Phone/email/Viber/Facebook confirmed.
liberty-auto;Liberty Auto;Либърти Ауто ООД;208232198;https://papagal.bg/eik/208232198/2e5d;2025-03-25;София;5;5,00 €;Борислав Веселинов Найденов (50%, управител) · Ахилеас Володиев Костов (50%, управител);;;;;yes;yes;;;;https://libertyauto.bg/;+359 887 341 537;+359 883 381 865;office@libertyauto.bg;https://www.facebook.com/libertyauto.bg;https://www.instagram.com/libertyauto.bg;https://invite.viber.com/?g2=AQAxYKocWHxtklQ1xfRyOWm4f1xlOx9DE4HIlexjdvc0KM7pKNhwy2JEx2G2sNIb;;;;;;;;Регистрирана 25.03.2025 г. от двама съсобственици и съуправители — Борислав Найденов и Ахилеас Костов (по 50%). Не е по ЗДДС. Предмет на дейност: внос, износ, реекспорт и покупко-продажба на МПС и резервни части. Адрес: София 1231, ж.к. Свобода 38, вх. Б, ет. 5, ап. 38.;2026-05-26;"Registry confirmed via agent-browser 2026-05-26 (papagal.bg). Legal Либърти Ауто ООД, EIK 208232198, основана 25.03.2025 в София. Капитал 10 лв., конвертиран на 19.02.2026 в 5 €. Седалище: София 1231, р-н Надежда, ж.к. Свобода 38, вх. Б, ет. 5, ап. 38. Двама съдружници по 50%: Борислав Веселинов Найденов и Ахилеас Володиев Костов — двамата и управители. Не е по ЗДДС. Предметът на дейност формално включва внос/износ на МПС и сервизна дейност от учредяването. Свързани фирми в papagal: МАУСТОЙС, ЛУЛАТОЙС (несвързани с автомобилен бранш). Phones нормализирани в +359-формат; FB/IG/Viber от libertyauto.bg запазени от предишна проверка."
usa-bg;USA-BG;"(Американско-българска фирма; БГ лице не е намерено)";;;;Ню Йорк + София;;;;;;;;yes;yes;;;;https://bg.usa-bg.com/;359 878 112 216;1 646 327 0103;info@usa-bg.com;https://www.facebook.com/shippingusabg;;;;;;;;;;Операция в две юрисдикции. Превозват коли, лодки, ATV, пратки. Българското юридическо лице не се открива в Търговския регистър при наличните търсения.;2026-05-24;Site OK. Phones confirmed (US+BG unchanged). Found email info@usa-bg.com and Facebook page. Registry not re-verified (papagal.bg blocks bot fetches).
usacars-bg;USACars.bg;Ю ЕС ЕЙ КАРС ЕООД (вероятно съответствие);206932180;https://papagal.bg/eik/206932180/310f;2022-05-11;София;511;511,00 €;СТЕФАНИ ВИКТОР БУДИНОВА (100%, и управител);;;;;yes;yes;;;;https://usacars.bg/;;;;;;;;;;;;;;Първоначално 'AVILA 2022', преименувана на Ю ЕС ЕЙ КАРС на 14.08.2024 г. Овча Купел, София. Внимание: US Cars Bulgaria (uscarsbulgaria.com) се представя като основана в САЩ през 2017 г. — връзката с българското лице не е изяснена.;2026-05-24;Registry confirmed via agent-browser 2026-05-24. Founded/city confirmed. Capital converted from 1 000 лв. to 511 €. Owner filled: СТЕФАНИ ВИКТОР БУДИНОВА (100%, и управител). Site OK but no contact info on homepage (blank/JS-rendered).
five-star;FIVE STAR AUTO;ФАЙВ СТАР АУТО ГРУП ЕООД;207733555;https://papagal.bg/eik/207733555/056b;2024-02-29;с. Еленово;5;5,00 €;ЕМИЛ АНГЕЛОВ ИВАНОВ (100%, и управител);;;;;yes;yes;;;;https://fivestarauto.bg/;359 876 855 205;;contact@fivestarauto.bg;https://www.facebook.com/fivestarsautoimport/;https://www.instagram.com/five_star_auto_bg/;https://invite.viber.com/?g2=AQA9Z1ce%2BvG28VIG4wIJlNJCmPLnuOo6bvLJ8ptzufRL2eItcKHyD1X6Szloic5b;;;;https://fivestarauto.mobile.bg/;;;;Работно време пон.–нед. 10:00–20:00. Малък деклариран капитал и регистрация в село.;2026-05-24;Registry confirmed via agent-browser 2026-05-24. Founded confirmed 2024-02-29. City confirmed (с. Еленово). Capital converted from 10 лв. to 5 €. Owner filled: ЕМИЛ АНГЕЛОВ ИВАНОВ (100%, и управител). Site OK. Phone confirmed. Found email contact@fivestarauto.bg. Socials confirmed.
american-auto;American AUTO;АМЕРИКАН АУТО ООД;207632702;https://papagal.bg/eik/207632702/e744;2023-12-13;Велико Търново;;;Мартин Станимирев Демирев (25%) · Диян Свиленов Крумов (25%) · МАРИЯ ДИМИТРОВА РУСЕВА (25%) · Денис Димитров Красимиров (25%);;;;yes;yes;yes;;;;;;;;https://www.facebook.com/AmericanAUTO21/;;;;;;https://americanauto.mobile.bg/;;;;Адрес: бул. България 72, Велико Търново. Дейности: търговия, логистика, внос на коли.;2026-05-24;Registry confirmed via agent-browser 2026-05-24. ЗАЛИЧЕН ТЪРГОВЕЦ на 26.09.2025 — company deregistered/dissolved. Owner at dissolution: 4 shareholders 25% each. No web. Facebook page alive (title confirmed). Mobile.bg listing americanauto.mobile.bg returns 404 as of 2026-05-24.
